{
  "id": "boston-tea-party",
  "title": "Boston Tea Party",
  "i18nKey": "act-boston-tea-party",
  "gradeBands": ["6-8"],
  "courses": ["us-history"],
  "mapType": "voices-around-event",
  "era": "american-revolution",
  "estimatedMinutes": 25,
  "summary": "Examine how Patriots, British officials, tea merchants, and other colonists viewed taxation, resistance, and British authority in the events surrounding the destruction of the tea.",
  "challenge": "challenge",
  "event": {
    "title": "Boston Tea Party",
    "date": "December 16, 1773",
    "place": "Griffin's Wharf, Boston"
  },
  "stakeholders": [
    {
      "id": "patriots",
      "nameKey": "sh_patriots",
      "icon": "flag",
      "teacher": {
        "wanted": "sh_patriots_wanted",
        "feared": "sh_patriots_feared",
        "action": "sh_patriots_action",
        "evidence": "sh_patriots_evidence",
        "affected": "sh_patriots_affected"
      }
    },
    {
      "id": "british-officials",
      "nameKey": "sh_british",
      "icon": "crown",
      "teacher": {
        "wanted": "sh_british_wanted",
        "feared": "sh_british_feared",
        "action": "sh_british_action",
        "evidence": "sh_british_evidence",
        "affected": "sh_british_affected"
      }
    },
    {
      "id": "merchants",
      "nameKey": "sh_merchants",
      "icon": "ship",
      "teacher": {
        "wanted": "sh_merchants_wanted",
        "feared": "sh_merchants_feared",
        "action": "sh_merchants_action",
        "evidence": "sh_merchants_evidence",
        "affected": "sh_merchants_affected"
      }
    },
    {
      "id": "other-colonists",
      "nameKey": "sh_colonists",
      "icon": "people",
      "teacher": {
        "wanted": "sh_colonists_wanted",
        "feared": "sh_colonists_feared",
        "action": "sh_colonists_action",
        "evidence": "sh_colonists_evidence",
        "affected": "sh_colonists_affected"
      }
    }
  ],
  "sources": [
    {
      "n": 1,
      "titleKey": "src1_title",
      "type": "primary",
      "url": "https://www.masshist.org/features/boston-tea-party",
      "descKey": "src1_desc",
      "questionKeys": ["src1_q1", "src1_q2"]
    },
    {
      "n": 2,
      "titleKey": "src2_title",
      "type": "primary",
      "url": "https://dp.la/primary-source-sets/the-boston-tea-party",
      "descKey": "src2_desc",
      "questionKeys": ["src2_q1", "src2_q2"]
    },
    {
      "n": 3,
      "titleKey": "src3_title",
      "type": "secondary",
      "url": "https://www.battlefields.org/learn/articles/boston-teapot-tonight",
      "descKey": "src3_desc",
      "questionKeys": ["src3_q1", "src3_q2"]
    }
  ],
  "comparePromptKeys": ["compare1", "compare2"],
  "conclusionKey": "conclusion",
  "ace": {
    "enabled": true,
    "articulateKey": "ace_articulate",
    "connectKey": "ace_connect",
    "extendKey": "ace_extend"
  },
  "teks": {
    "standardsFile": "standards/teks-grade8-us.json",
    "content": ["8.4(A)", "8.4(B)", "8.1(A)"],
    "skills": ["8.29(A)", "8.29(D)", "8.29(E)", "8.29(F)"]
  },
  "teacher": {
    "keyIdeasKey": "t_keyideas",
    "misconceptionsKey": "t_misconceptions",
    "vocabularyKey": "t_vocabulary",
    "contextKey": "t_context",
    "extensionKey": "t_extension"
  },
  "tags": ["american-revolution", "multiple-perspectives", "primary-sources", "cause-and-effect", "taxation"],
  "translationStatus": {
    "en": "human",
    "es": "mt-pending-review",
    "vi": "mt-pending-review",
    "ar": "mt-pending-review",
    "zh": "mt-pending-review",
    "ur": "mt-pending-review",
    "hi": "mt-pending-review"
  }
}
